{
  "$schema": "https://json-schema.org/draft/2020-12/schema",
  "$id": "review-input.schema.json",
  "title": "review-input.json (review:gate submission)",
  "type": "object",
  "additionalProperties": true,
  "required": [
    "gate_version",
    "tenant_id",
    "change_id",
    "pr_id",
    "title",
    "generated_at",
    "source_commit",
    "run_id",
    "files_changed",
    "scope",
    "domain_tags",
    "summary",
    "decider",
    "risk_acceptances",
    "scenarios",
    "concurrency_model",
    "ops_impact",
    "trigger_evidence",
    "artifacts",
    "coverage_report",
    "findings",
    "verification",
    "readiness"
  ],
  "properties": {
    "gate_version": { "type": "string", "minLength": 1 },
    "tenant_id": {
      "type": "string",
      "minLength": 1,
      "pattern": "^[a-z0-9]+(?:-[a-z0-9]+)*$",
      "description": "Lowercase tenant slug like \"tvg\" or \"vent-guys\"."
    },
    "change_id": { "type": "string", "minLength": 1 },
    "pr_id": { "type": "string", "minLength": 1, "description": "Use \"LOCAL\" when not in a PR." },
    "title": { "type": "string", "minLength": 1 },
    "generated_at": { "type": "string", "format": "date-time" },
    "source_commit": {
      "type": "string",
      "pattern": "^[0-9a-fA-F]{7,40}$",
      "description": "Git SHA-like hex string."
    },
    "run_id": { "type": "string", "format": "date-time" },
    "files_changed": {
      "type": "array",
      "minItems": 1,
      "items": { "type": "string", "minLength": 1 }
    },
    "scope": {
      "type": "object",
      "additionalProperties": true,
      "required": ["included"],
      "properties": {
        "included": {
          "type": "array",
          "minItems": 1,
          "items": { "type": "string", "minLength": 1 }
        },
        "excluded": { "type": "array", "items": { "type": "string", "minLength": 1 } }
      }
    },
    "domain_tags": {
      "type": "array",
      "items": { "type": "string", "minLength": 1 },
      "description": "Tags used for critical-domain triggering. The enforced trigger set is in review-policy.json (critical_domains)."
    },
    "summary": { "type": "string", "minLength": 1 },
    "decider": {
      "type": "object",
      "additionalProperties": true,
      "required": ["name", "role", "approved_at"],
      "properties": {
        "name": { "type": "string", "minLength": 1 },
        "role": { "type": "string", "minLength": 1 },
        "approved_at": { "type": "string", "format": "date-time" }
      }
    },
    "risk_acceptances": {
      "type": "array",
      "items": {
        "type": "object",
        "additionalProperties": true,
        "required": ["expires_at"],
        "properties": {
          "owner": { "type": "string" },
          "reason": { "type": "string" },
          "probability": { "type": "string", "enum": ["LOW", "MEDIUM", "HIGH"] },
          "blast_radius": { "type": "string", "enum": ["LOW", "MEDIUM", "HIGH", "CATASTROPHIC"] },
          "expires_at": { "type": "string", "format": "date-time" }
        }
      }
    },
    "scenarios": {
      "type": "array",
      "items": {
        "type": "object",
        "additionalProperties": true,
        "required": ["category", "scenario", "expected_behavior", "verification_method", "evidence_required"],
        "properties": {
          "category": { "type": "string", "minLength": 1 },
          "scenario": { "type": "string", "minLength": 1 },
          "expected_behavior": { "type": "string", "minLength": 1 },
          "verification_method": { "type": "string", "minLength": 1 },
          "evidence_required": { "type": "array", "minItems": 1, "items": { "type": "string", "minLength": 1 } }
        }
      }
    },
    "concurrency_model": {
      "type": "object",
      "additionalProperties": true,
      "required": ["model", "guarantees", "non_guarantees"],
      "properties": {
        "model": { "type": "string", "enum": ["dedupe_based", "lock_based"] },
        "guarantees": { "type": "array", "minItems": 1, "items": { "type": "string", "minLength": 1 } },
        "non_guarantees": { "type": "array", "minItems": 1, "items": { "type": "string", "minLength": 1 } },
        "lock_strategy": { "type": "string" }
      }
    },
    "ops_impact": {
      "type": "object",
      "additionalProperties": true,
      "required": ["alert_dedupe_identity", "max_open_alerts_per_entity", "task_dedupe_rule"],
      "properties": {
        "alert_dedupe_identity": { "type": "string", "minLength": 1 },
        "max_open_alerts_per_entity": { "type": "string", "minLength": 1 },
        "task_dedupe_rule": { "type": "string", "minLength": 1 }
      }
    },
    "trigger_evidence": {
      "type": "object",
      "additionalProperties": true,
      "required": ["derived_domain_tags", "derivation_inputs"],
      "properties": {
        "derived_domain_tags": { "type": "array", "minItems": 1, "items": { "type": "string", "minLength": 1 } },
        "derivation_inputs": { "type": "array", "minItems": 1, "items": { "type": "string", "minLength": 1 } }
      }
    },
    "artifacts": {
      "type": "array",
      "minItems": 1,
      "items": {
        "type": "object",
        "additionalProperties": true,
        "required": ["type", "label", "proof_of", "path"],
        "properties": {
          "type": { "type": "string" },
          "label": { "type": "string", "minLength": 1 },
          "proof_of": { "type": "string", "minLength": 1 },
          "path": { "type": "string", "minLength": 1 },
          "sha256": { "type": "string" },
          "snippet": { "type": "string" },
          "created_at": { "type": "string", "format": "date-time" },
          "notes": { "type": "string" }
        }
      }
    },
    "coverage_report": {
      "type": "object",
      "additionalProperties": true,
      "required": ["files_analyzed", "discovery_inputs", "excluded_scope", "uncertainty_boundaries"],
      "properties": {
        "files_analyzed": { "type": "array", "minItems": 1, "items": { "type": "string", "minLength": 1 } },
        "discovery_inputs": { "type": "array", "items": { "type": "string", "minLength": 1 } },
        "excluded_scope": { "type": "array", "items": { "type": "string", "minLength": 1 } },
        "uncertainty_boundaries": { "type": "array", "items": { "type": "string", "minLength": 1 } }
      }
    },
    "findings": {
      "type": "array",
      "minItems": 1,
      "items": {
        "type": "object",
        "additionalProperties": true,
        "required": [
          "id",
          "title",
          "severity",
          "business_impact",
          "rule_violated",
          "proof",
          "recommended_action",
          "verification_method",
          "closure_evidence_required"
        ],
        "properties": {
          "id": { "type": "string", "minLength": 1 },
          "title": { "type": "string", "minLength": 1 },
          "severity": { "type": "string", "minLength": 1 },
          "business_impact": { "type": "string", "minLength": 1 },
          "rule_violated": { "type": "string", "minLength": 1 },
          "proof": { "type": "array", "minItems": 1, "items": { "type": "string", "minLength": 1 } },
          "recommended_action": { "type": "string", "minLength": 1 },
          "verification_method": { "type": "string", "minLength": 1 },
          "closure_evidence_required": { "type": "array", "minItems": 1, "items": { "type": "string", "minLength": 1 } }
        }
      }
    },
    "verification": {
      "type": "object",
      "additionalProperties": true,
      "description": "Critical-domain required keys are enforced by review:gate from review-policy.json. This schema stays permissive to avoid drift."
    },
    "readiness": {
      "type": "object",
      "additionalProperties": true,
      "required": ["status", "labels"],
      "properties": {
        "status": { "type": "string", "enum": ["NOT_READY", "CONDITIONALLY_READY", "READY"] },
        "labels": { "type": "array", "items": { "type": "string", "enum": ["P0-02: LOCAL_PROVEN", "P0-02: PRODUCTION-VALIDATED"] } },
        "production_artifacts": { "type": "array", "items": { "type": "string", "minLength": 1 } }
      }
    }
  }
}

